{
  "$schema": "https://json-schema.org/draft/2020-12/schema",
  "$id": "https://openai.local/ai-ip/billing-policy.schema.json",
  "type": "object",
  "additionalProperties": false,
  "required": ["schemaVersion", "providerLabel", "currency", "effectiveAt", "sourceCommitment", "reasoningTokensBilledSeparately", "supplierActualPrecedence", "rounding"],
  "properties": {
    "schemaVersion": {"const": 1},
    "providerLabel": {"$ref": "#/$defs/label"},
    "currency": {"const": "CNY"},
    "effectiveAt": {"$ref": "#/$defs/timestamp"},
    "sourceCommitment": {"$ref": "#/$defs/sha256"},
    "reasoningTokensBilledSeparately": {"const": false},
    "supplierActualPrecedence": {"const": "maxEstimatedOrSupplierActual"},
    "rounding": {"const": "ceilingToFen"}
  },
  "$defs": {
    "label": {"type": "string", "pattern": "^[A-Za-z0-9][A-Za-z0-9._:+/@() -]{0,199}$"},
    "timestamp": {"type": "string", "pattern": "^\\d{4}-\\d{2}-\\d{2}T\\d{2}:\\d{2}:\\d{2}\\.\\d{3}Z$"},
    "sha256": {"type": "string", "pattern": "^[0-9a-f]{64}$"}
  }
}
