{
  "schemaVersion": 1,
  "providerLabel": "approved-provider",
  "currency": "CNY",
  "effectiveAt": "2026-08-30T10:00:00.000Z",
  "sourceCommitment": "aaaaaaaaaaaaaaaaaaaaaaaaaaaaaaaaaaaaaaaaaaaaaaaaaaaaaaaaaaaaaaaa",
  "reasoningTokensBilledSeparately": false,
  "supplierActualPrecedence": "maxEstimatedOrSupplierActual",
  "rounding": "ceilingToFen"
}
